{
  "$schema": "http://json-schema.org/draft-07/schema#",
  "type": "object",
  "properties": {
    "generatedAt": {
      "type": "string"
    },
    "totalVisits": {
      "type": "integer",
      "minimum": -9007199254740991,
      "maximum": 9007199254740991
    },
    "totalPlaces": {
      "type": "integer",
      "minimum": -9007199254740991,
      "maximum": 9007199254740991
    },
    "totalDurationHours": {
      "type": "number"
    },
    "citiesVisited": {
      "type": "integer",
      "minimum": -9007199254740991,
      "maximum": 9007199254740991
    },
    "currentCity": {
      "anyOf": [
        {
          "type": "string"
        },
        {
          "type": "null"
        }
      ]
    },
    "lastSeen": {
      "anyOf": [
        {
          "type": "string"
        },
        {
          "type": "null"
        }
      ]
    },
    "last90Days": {
      "type": "array",
      "items": {
        "type": "object",
        "properties": {
          "date": {
            "type": "string"
          },
          "count": {
            "type": "integer",
            "minimum": -9007199254740991,
            "maximum": 9007199254740991
          },
          "uniquePlaces": {
            "type": "integer",
            "minimum": -9007199254740991,
            "maximum": 9007199254740991
          },
          "totalDurationMinutes": {
            "type": "integer",
            "minimum": -9007199254740991,
            "maximum": 9007199254740991
          }
        },
        "required": [
          "date",
          "count",
          "uniquePlaces",
          "totalDurationMinutes"
        ],
        "additionalProperties": false
      }
    },
    "topPlaces": {
      "type": "array",
      "items": {
        "type": "object",
        "properties": {
          "name": {
            "type": "string"
          },
          "category": {
            "anyOf": [
              {
                "type": "string"
              },
              {
                "type": "null"
              }
            ]
          },
          "visitCount": {
            "type": "integer",
            "minimum": -9007199254740991,
            "maximum": 9007199254740991
          },
          "totalDurationMinutes": {
            "type": "integer",
            "minimum": -9007199254740991,
            "maximum": 9007199254740991
          },
          "lastVisitAt": {
            "anyOf": [
              {
                "type": "string"
              },
              {
                "type": "null"
              }
            ]
          }
        },
        "required": [
          "name",
          "category",
          "visitCount",
          "totalDurationMinutes",
          "lastVisitAt"
        ],
        "additionalProperties": false
      }
    },
    "cityBreakdown": {
      "type": "array",
      "items": {
        "type": "object",
        "properties": {
          "city": {
            "type": "string"
          },
          "visitCount": {
            "type": "integer",
            "minimum": -9007199254740991,
            "maximum": 9007199254740991
          }
        },
        "required": [
          "city",
          "visitCount"
        ],
        "additionalProperties": false
      }
    },
    "categoryBreakdown": {
      "type": "array",
      "items": {
        "type": "object",
        "properties": {
          "category": {
            "type": "string"
          },
          "visitCount": {
            "type": "integer",
            "minimum": -9007199254740991,
            "maximum": 9007199254740991
          },
          "totalMinutes": {
            "type": "integer",
            "minimum": -9007199254740991,
            "maximum": 9007199254740991
          }
        },
        "required": [
          "category",
          "visitCount",
          "totalMinutes"
        ],
        "additionalProperties": false
      }
    },
    "streaks": {
      "type": "object",
      "properties": {
        "currentStreak": {
          "type": "integer",
          "minimum": -9007199254740991,
          "maximum": 9007199254740991
        },
        "longestStreak": {
          "type": "integer",
          "minimum": -9007199254740991,
          "maximum": 9007199254740991
        },
        "totalActiveDays": {
          "type": "integer",
          "minimum": -9007199254740991,
          "maximum": 9007199254740991
        }
      },
      "required": [
        "currentStreak",
        "longestStreak",
        "totalActiveDays"
      ],
      "additionalProperties": false
    },
    "explorationStats": {
      "type": "object",
      "properties": {
        "totalNeighborhoods": {
          "type": "integer",
          "minimum": -9007199254740991,
          "maximum": 9007199254740991
        },
        "totalCities": {
          "type": "integer",
          "minimum": -9007199254740991,
          "maximum": 9007199254740991
        },
        "totalStates": {
          "type": "integer",
          "minimum": -9007199254740991,
          "maximum": 9007199254740991
        }
      },
      "required": [
        "totalNeighborhoods",
        "totalCities",
        "totalStates"
      ],
      "additionalProperties": false
    }
  },
  "required": [
    "generatedAt",
    "totalVisits",
    "totalPlaces",
    "totalDurationHours",
    "citiesVisited",
    "currentCity",
    "lastSeen",
    "last90Days",
    "topPlaces",
    "cityBreakdown",
    "categoryBreakdown",
    "streaks",
    "explorationStats"
  ],
  "additionalProperties": false
}
